{
  "invocationId": "11111111-1111-4111-8111-111111111111",
  "observationId": "22222222-2222-4222-8222-222222222222",
  "targetId": "33333333-3333-4333-8333-333333333333",
  "bundleId": "44444444-4444-4444-8444-444444444444",
  "state": "deferred",
  "admitted": false,
  "reason": "robots_unknown",
  "policyVersion": "discovery-v1"
}
